trail_name,location,flower,animal,eco_tips
Creekside Loop,San Jose,Willow trees,Cottontail rabbits,"Stay on the trail to avoid trampling roots"
Riparian Pass,Los Gatos,Riparian shrubs,Western pond turtles,"Avoid leaving food scraps to protect wildlife"
Sunset Hill,Cupertino,Manzanita,Red-tailed hawks,"Do not pick wildflowers – let them reseed naturally"
Oak Ridge Trail,Morgan Hill,Coastal live oaks,Deer and y,"Pack out all trash and food waste"
Eagle Rock Trail,Gilroy,Chaparral bushes,California quail,"Keep noise levels low to avoid disturbing wildlife"
